finding_id,is_on_topic,reasoning_note
finding-20,1,Kenya hosts France Macron relationship matters Nairobi — direct
finding-185,1,France African Summit Kenya diversify alliances Nairobi — direct
finding-193,1,Kenya France sign 11 deals Ruto Looking Forward partnership — direct
finding-489,1,France turns to Africa strategic partnerships post-Sahel — direct
finding-525,1,In Nairobi Macron ends decade of France-Africa turmoil — direct
finding-549,1,Afrika-Gipfel Kenia Macron neue Partner Strategie — direct
finding-819,1,Tinubu arrives Kenya Africa Forward Summit participate — direct
finding-1051,1,Changing geopolitics France's Macron kicks off Kenya Africa Forward — direct
finding-1174,1,Africa Forward Nairobi sommet coorganisé Kenya France — direct
