finding_id,is_on_topic,reasoning_note
finding-57,1,Lula reveals Trump's lack of intent to invade Cuba after meeting — direct
finding-131,1,Lula won't sideline China in rare earths tells Trump during meeting — direct
finding-330,1,Trump y Lula reunión aranceles tensión Casa Blanca — direct
finding-511,1,Trump and Lula private Oval Office meeting signals strain — direct
finding-869,1,Trump Lula relanzada relación EEUU Brasil tras encuentro — direct
finding-1038,1,Após encontro Trump diz Lula homem bom cara esperto — direct
finding-1061,1,Esquerda vê bolsonarismo isolado após encontro Lula-Trump — direct
finding-1066,1,Encontro Lula Trump portas fechadas leitor — direct
finding-1072,1,Tarifas guerra Copa amor primeira vista Lula Trump — direct
finding-1087,1,Lula propõe grupo trabalho EUA resolver impasse tarifas após encontro — direct
finding-1226,1,Brazil Lula sees reset relations US after Trump talks — direct
finding-1393,1,Trump and Lula at White House pragmatism regional cast — direct
