finding_id,is_on_topic,reasoning_note
finding-116,0,"SCMP weekly highlights roundup, not specifically the defense-minister case"
finding-521,1,China announces suspended death sentences for former defence ministers — direct
finding-675,1,China verurteilt zwei Ex-Verteidigungsminister zur Todesstrafe — direct (German)
finding-1109,0,"Suspended death sentence for ex-Chongqing city official, not defense minister"
finding-1202,1,China's former defense ministers sentenced to death with reprieve — direct
