finding_id,is_on_topic,reasoning_note
finding-507,1,"Zelensky's ex-chief of staff Yermak in court Ukraine corruption probe — direct"
finding-750,1,"Прокуратура Украины Ермака арестовать залог легализация коррупция — direct"
finding-741,1,"Антикоррупционное бюро Ермак подозреваемый 10 млн долл — direct"
finding-737,1,"Антикоррупционная прокуратура Украины ареста Ермака — direct"
finding-9,1,"Zelenskyy's ex-chief of staff Yermak appears court money-laundering 10.5m — direct"
finding-789,1,"Mystery partner ex-Zelensky aide Yermak laundering NABU — direct"
finding-752,0,"Ашурков ФБК Навальный Дудю интервью"
finding-743,0,"Palantir Карп Украина Минобороны системы анализа"
finding-727,0,"Ашурков ФБК Дудю интервью трехчасовое"
finding-1080,0,"MP-SP procedimento promotor arquivar Mona"
finding-729,1,"Ермак суде не признает вину отмывание денег — direct"
finding-942,0,"Özgür Özel çantacısı gözaltında yolsuzluk"
finding-694,0,"Ukrainische Deep strikes Russland Selenskyj Taurus"
finding-1397,0,"Digital hunt Ukraine missing children ICC Putin"
finding-1118,0,"Torturas aislamiento ucranianos detenidos prisión rusa"
finding-1192,0,"Prisión preventiva apuñalar Los Hornos Cubilla"
finding-717,0,"Буцаев замминистра природных ресурсов США"
finding-370,0,"Treasury opposition Senate JUI-F terrorism KP"
finding-720,0,"Мошкович Русагро национализация прецедент"
finding-767,0,"Abducted Ukrainian teen Chvylova Russian children commissioner"
finding-1091,0,"Dentista absolvido estupros Rio condenado"
finding-1358,0,"Ukraine conscription crisis bloody"
finding-774,0,"Ukrainian press gangs draft officers bussification"
finding-135,0,"SBU detains Russian spotter Sloviansk Donetsk"
finding-639,0,"1MDB Jho Low asks Trump pardon"
finding-1166,0,"FBI Patel prueba consumo alcohol acusaciones"
finding-152,0,"Zelensky strikes Russian targets Oren gas facilities"
finding-907,0,"BAE Mirage gizli saldırı İran"
finding-885,0,"Feijóo Zapatero presidencia llevarse dinero"
finding-563,0,"Sarkozy Libya funding appeal sentences"
finding-765,0,"Russia sanctions individuals exposed Kyiv Independent documentary"
finding-654,0,"Ukraine broaden diplomatic horizon selling arms"
finding-104,0,"Malaysia Jho Low seeking Trump pardon 1MDB"
finding-1126,0,"Cerebro trama corrupción 1MDB perdón Trump"
finding-732,0,"Певица Линда обыски авторские права Фадеев"
finding-884,0,"Chaves PSOE andaluz rescate Montero"
finding-122,0,"Yulia Navalnaya Rejects Fictitious Employees FBK Infighting"
finding-277,0,"Sheinbaum políticos investigados EU Adrián"
finding-734,0,"Сармат успешные испытания командующий"
finding-1372,0,"Bénin Sounon Boké tentative coup d'État"
finding-653,0,"Seine murders psychiatric assessment Monji"
finding-313,0,"Sheinbaum huachicol fiscal Rafael Ojeda"
finding-769,0,"Sergey Lavrov interview RT India Delhi"
finding-555,0,"Former private prison official acting ICE chief Venturella"
finding-1106,0,"Irán ejecuta hombre espionaje Israel"
finding-740,0,"Юлия Мендель Зеленского Такер Карлсон"
finding-958,0,"Eurasianet undesirable organization Russia"
finding-747,0,"Самары 350 тысяч рублей сфабрикованному делу"
finding-1007,0,"Campanha pró-Ypê teorias conspiratórias direita"
finding-756,0,"Ukraine sanctions 66 Russian companies military-industrial"
finding-915,0,"Kraliçe Mathilde İstanbul mesai"
finding-150,0,"Russia plan Kupiansk fails Oskil River"
finding-1258,0,"Iran Araghchi Russia Lavrov Delhi BRICS"
finding-921,0,"Bahis siteleri İstanbul yasadışı"
finding-913,0,"İZBETON İZDOĞA İzmir 3 tutuklama"
finding-722,0,"Binance СНГ Смеркис пять лет"
finding-91,0,"Japan Takaichi aide smear LDP rivals"
finding-1164,0,"Mossos tiroteo Mina Sant Adrià"
finding-1354,0,"Don't Fall for Rumors of Putin's Weakness"
finding-768,0,"Ukraine strikes Russian targets occupied Donetsk Oblast"
finding-780,0,"Zelensky's ex-spokeswoman kill list Mirotvorets Mendel"
finding-132,0,"Russian agent sentenced 15 years gas pipeline eastern Ukraine"
finding-763,0,"Ukraine searches 100 vape shops shadow economy"
finding-661,0,"Bundesunternehmen Putin Vertrauten LNG"
finding-675,0,"Bundeskriminalamt Cyberangriffe Risiko"
finding-733,0,"Крокодил Гена Хоттабыч предупреждениями наркотиков"
finding-929,0,"AKHİSAR 3 ASLİYE HUKUK legal notice"
finding-549,0,"Kash Patel false claims Democrat FBI drinking"
finding-1097,0,"Guardias presos escapar Piñero Santa Fe"
finding-350,0,"Russia Tests Nuclear-Capable Satan II Missile 35,000 km"
finding-749,0,"Сармат успешный пуск Путин"
finding-961,0,"Armenia thumbs nose Kremlin EU endorsement"
finding-145,0,"War update 170 combat clashes Pokrovsk Kostiantynivka"
finding-792,0,"Russia test-fires state-of-the-art ICBM Sarmat"
finding-663,0,"Datenanalyse-Software Verfassungsschutz Palantir-Alternative"
finding-934,0,"Özkan Yalım etkin pişmanlık ifade Özgür Özel mesaj"
finding-726,0,"Россия Кривому Рогу двое погибших"
finding-120,0,"Russia Foreign Ministry Central Asia anti-Russian staging"
finding-1076,0,"Oposição impeachment Moraes redução penas"
finding-1116,0,"Juicio crimen adolescente disputa barrio"
finding-753,0,"Истина в ИИ Питер Тиль частный суд Objection.ai"
finding-1200,0,"Persona muerta denunciante caso policías Chañar"
finding-123,0,"TV Rain Editor Tikhon Dzyadko Jailed 8 Years"
finding-947,0,"Galatasaray Van Dijk Anlaşma transfer"
finding-1011,0,"Azzas 2154 Birman Jatahy Hering Arezzo"
finding-1171,0,"Rusia 139 drones Ucrania noche"
finding-1015,0,"Marcos Lisboa Maria Paula Curado diagnóstico"
finding-107,0,"FBI Director Kash Patel denies drinking testy Senate"
finding-807,0,"Empresario Zapatero Plus Ultra blanqueo"
finding-787,0,"Gabbard probe US-funded foreign biolabs"
finding-137,0,"Sikorski Putin recognition failed war aims NATO"
finding-1009,0,"Kassio TSE Bolsonaro elegível"
finding-147,0,"Zelensky Kryvyi Rih strike Russia killing"
finding-1073,0,"Caso Orelha defesa Promotoria jovens"
finding-716,0,"Украина порт Тамань Краснодарском"
finding-781,0,"West laughed Russia biolabs claims facts"
finding-557,0,"OpenAI Sam Altman Elon Musk stole accusation trial"
finding-134,0,"Kremlin criminal networks mercenaries destabilize EU"
finding-366,0,"Adiala Imran Bushra meetings PTI Gilgit"
finding-786,0,"Moscow mocks UK psychiatric hospital sanctions"
finding-1053,0,"Comissão Segurança Câmara FGTS comprar arma"
finding-962,0,"Central Asian states sanctions-busting Russia"
finding-25,0,"Mossad spy Iranian intelligence Israel hanged"
finding-275,0,"Mayo Zambada Iván Archivaldo traición avión"
finding-836,0,"Villarejo fraude fiscal Hacienda 1.6 millones"
finding-998,0,"Bancos juros consignado INSS fórmula automática"
finding-194,0,"Mavoko land cartels fraud Kenya court"
